{
  "canonical": {
    "monthly": [
      {
        "count_mom_pct": "0.000000",
        "listing_count": 96,
        "median_ppsf_usd": "172.917240",
        "median_price_usd": "327998.000000",
        "month": "2025-08",
        "ppsf_mom_pct": "-2.087774",
        "ppsf_yoy_pct": null,
        "price_mom_pct": "-0.852732",
        "price_yoy_pct": null
      },
      {
        "count_mom_pct": "0.000000",
        "listing_count": 96,
        "median_ppsf_usd": "180.482729",
        "median_price_usd": "334527.500000",
        "month": "2025-09",
        "ppsf_mom_pct": "4.375208",
        "ppsf_yoy_pct": null,
        "price_mom_pct": "1.990713",
        "price_yoy_pct": null
      },
      {
        "count_mom_pct": "0.000000",
        "listing_count": 96,
        "median_ppsf_usd": "181.018403",
        "median_price_usd": "337774.500000",
        "month": "2025-10",
        "ppsf_mom_pct": "0.296801",
        "ppsf_yoy_pct": "6.884231",
        "price_mom_pct": "0.970623",
        "price_yoy_pct": "2.750565"
      },
      {
        "count_mom_pct": "0.000000",
        "listing_count": 96,
        "median_ppsf_usd": "179.284542",
        "median_price_usd": "330302.000000",
        "month": "2025-11",
        "ppsf_mom_pct": "-0.957837",
        "ppsf_yoy_pct": "5.821889",
        "price_mom_pct": "-2.212275",
        "price_yoy_pct": "5.493249"
      },
      {
        "count_mom_pct": "0.000000",
        "listing_count": 96,
        "median_ppsf_usd": "179.610268",
        "median_price_usd": "330863.500000",
        "month": "2025-12",
        "ppsf_mom_pct": "0.181681",
        "ppsf_yoy_pct": "2.888962",
        "price_mom_pct": "0.169996",
        "price_yoy_pct": "2.858693"
      },
      {
        "count_mom_pct": "0.000000",
        "listing_count": 96,
        "median_ppsf_usd": "180.575705",
        "median_price_usd": "335013.000000",
        "month": "2026-01",
        "ppsf_mom_pct": "0.537518",
        "ppsf_yoy_pct": "2.179696",
        "price_mom_pct": "1.254143",
        "price_yoy_pct": "3.963171"
      },
      {
        "count_mom_pct": "0.000000",
        "listing_count": 96,
        "median_ppsf_usd": "181.404847",
        "median_price_usd": "334770.500000",
        "month": "2026-02",
        "ppsf_mom_pct": "0.459166",
        "ppsf_yoy_pct": "3.995636",
        "price_mom_pct": "-0.072385",
        "price_yoy_pct": "5.040704"
      },
      {
        "count_mom_pct": "0.000000",
        "listing_count": 96,
        "median_ppsf_usd": "182.364957",
        "median_price_usd": "336937.500000",
        "month": "2026-03",
        "ppsf_mom_pct": "0.529264",
        "ppsf_yoy_pct": "2.562415",
        "price_mom_pct": "0.647309",
        "price_yoy_pct": "1.273366"
      },
      {
        "count_mom_pct": "0.000000",
        "listing_count": 96,
        "median_ppsf_usd": "185.206947",
        "median_price_usd": "342056.500000",
        "month": "2026-04",
        "ppsf_mom_pct": "1.558408",
        "ppsf_yoy_pct": "6.820108",
        "price_mom_pct": "1.519273",
        "price_yoy_pct": "2.760249"
      },
      {
        "count_mom_pct": "0.000000",
        "listing_count": 96,
        "median_ppsf_usd": "185.352846",
        "median_price_usd": "344969.500000",
        "month": "2026-05",
        "ppsf_mom_pct": "0.078776",
        "ppsf_yoy_pct": "5.905844",
        "price_mom_pct": "0.851614",
        "price_yoy_pct": "6.134991"
      },
      {
        "count_mom_pct": "0.000000",
        "listing_count": 96,
        "median_ppsf_usd": "179.473931",
        "median_price_usd": "323205.000000",
        "month": "2026-06",
        "ppsf_mom_pct": "-3.171742",
        "ppsf_yoy_pct": "0.056094",
        "price_mom_pct": "-6.309108",
        "price_yoy_pct": "-0.373747"
      },
      {
        "count_mom_pct": "0.000000",
        "listing_count": 96,
        "median_ppsf_usd": "179.085350",
        "median_price_usd": "330009.500000",
        "month": "2026-07",
        "ppsf_mom_pct": "-0.216511",
        "ppsf_yoy_pct": "1.404841",
        "price_mom_pct": "2.105320",
        "price_yoy_pct": "-0.244696"
      }
    ],
    "summary": {
      "last_month_ppsf_yoy_pct": "1.404841",
      "last_month_price_yoy_pct": "-0.244696",
      "total_observations": 1152,
      "window_ppsf_change_pct": "3.567088",
      "window_price_change_pct": "0.613266",
      "zip_rankings": []
    },
    "window_end": "2026-07",
    "window_start": "2025-08"
  },
  "metadata": {
    "contract_version": "1.0",
    "dataset_id": "dallas-synth-v1",
    "dataset_view_sha256": "4a968398a324260ae41c44afb304d374beae91a34d2612ed0c9a92152f85f00f",
    "effective_seed": 130363,
    "live_campaign_id": "headline-live-v1",
    "logical_multiset_sha256": "ddb1de062533761174a10ab9b553ef546070d5824c56d397f9ca7e8fe59dcfbc",
    "mode": "live",
    "model_profile": "housing-qwen-v4-s130363",
    "prompt_bundle_sha256": "47c9578424b4c58836d002685bf6173c4687fe4fe48bcda41ddeeb9cecdbc4f6",
    "query_sha256": "61226454b63c8bf627965689f073fb4dd43180351bfee7807c8b36d90632a148",
    "requested_seed": 130363,
    "run_id": "20261005T041818Z-90b4bb6ef6",
    "seed_support": "verified_model_default",
    "snapshot_sha256": "bb0e9f3ed47a65eabbaab4e0a4de192ca7918a61eee111e273a70e145f87692b",
    "trace_path": "artifacts/campaigns/headline-live-v1/cases/MR03-b012-s130363/attempt-001/followup/runs/20261005T041818Z-90b4bb6ef6/trace.jsonl"
  },
  "narrative": {
    "caveat_codes": [
      "SYNTHETIC_DATA",
      "UNAVAILABLE_LOOKBACK"
    ],
    "fact_ids": [
      "first_to_last_price",
      "last_month_yoy",
      "observations",
      "support"
    ],
    "text": "First-to-last median price change: 0.613266% across eleven monthly intervals. Final-month median price year-over-year change: -0.244696%. 1152 qualifying monthly observations from 2025-08 through 2026-07. All twelve visible months have at least five qualifying observations. Synthetic Dallas-themed test feed; these are generated observations. Some comparison months are outside the source snapshot."
  },
  "presentation": {
    "area": "SQFT",
    "money": "USD",
    "monthly": [
      {
        "median_price": "327998.000000",
        "median_price_per_area": "172.917240",
        "month": "2025-08"
      },
      {
        "median_price": "334527.500000",
        "median_price_per_area": "180.482729",
        "month": "2025-09"
      },
      {
        "median_price": "337774.500000",
        "median_price_per_area": "181.018403",
        "month": "2025-10"
      },
      {
        "median_price": "330302.000000",
        "median_price_per_area": "179.284542",
        "month": "2025-11"
      },
      {
        "median_price": "330863.500000",
        "median_price_per_area": "179.610268",
        "month": "2025-12"
      },
      {
        "median_price": "335013.000000",
        "median_price_per_area": "180.575705",
        "month": "2026-01"
      },
      {
        "median_price": "334770.500000",
        "median_price_per_area": "181.404847",
        "month": "2026-02"
      },
      {
        "median_price": "336937.500000",
        "median_price_per_area": "182.364957",
        "month": "2026-03"
      },
      {
        "median_price": "342056.500000",
        "median_price_per_area": "185.206947",
        "month": "2026-04"
      },
      {
        "median_price": "344969.500000",
        "median_price_per_area": "185.352846",
        "month": "2026-05"
      },
      {
        "median_price": "323205.000000",
        "median_price_per_area": "179.473931",
        "month": "2026-06"
      },
      {
        "median_price": "330009.500000",
        "median_price_per_area": "179.085350",
        "month": "2026-07"
      }
    ]
  },
  "quality": {
    "codes": [
      "SYNTHETIC_DATA",
      "UNAVAILABLE_LOOKBACK"
    ],
    "sparse_months": [],
    "status": "complete"
  },
  "status": "completed"
}
