{
  "canonical": {
    "monthly": [
      {
        "count_mom_pct": "0.000000",
        "listing_count": 160,
        "median_ppsf_usd": "197.094741",
        "median_price_usd": "346840.500000",
        "month": "2025-10",
        "ppsf_mom_pct": "1.794568",
        "ppsf_yoy_pct": "4.334685",
        "price_mom_pct": "0.196296",
        "price_yoy_pct": "2.637092"
      },
      {
        "count_mom_pct": "0.000000",
        "listing_count": 160,
        "median_ppsf_usd": "197.105321",
        "median_price_usd": "346929.500000",
        "month": "2025-11",
        "ppsf_mom_pct": "0.005368",
        "ppsf_yoy_pct": "3.276382",
        "price_mom_pct": "0.025660",
        "price_yoy_pct": "-0.471779"
      },
      {
        "count_mom_pct": "0.000000",
        "listing_count": 160,
        "median_ppsf_usd": "195.624195",
        "median_price_usd": "358767.500000",
        "month": "2025-12",
        "ppsf_mom_pct": "-0.751439",
        "ppsf_yoy_pct": "2.532457",
        "price_mom_pct": "3.412221",
        "price_yoy_pct": "6.747607"
      },
      {
        "count_mom_pct": "0.000000",
        "listing_count": 160,
        "median_ppsf_usd": "199.376972",
        "median_price_usd": "356100.000000",
        "month": "2026-01",
        "ppsf_mom_pct": "1.918361",
        "ppsf_yoy_pct": "3.691177",
        "price_mom_pct": "-0.743518",
        "price_yoy_pct": "0.605867"
      },
      {
        "count_mom_pct": "0.000000",
        "listing_count": 160,
        "median_ppsf_usd": "202.567495",
        "median_price_usd": "355368.000000",
        "month": "2026-02",
        "ppsf_mom_pct": "1.600246",
        "ppsf_yoy_pct": "2.841363",
        "price_mom_pct": "-0.205560",
        "price_yoy_pct": "1.948060"
      },
      {
        "count_mom_pct": "0.000000",
        "listing_count": 160,
        "median_ppsf_usd": "203.360307",
        "median_price_usd": "368228.000000",
        "month": "2026-03",
        "ppsf_mom_pct": "0.391382",
        "ppsf_yoy_pct": "4.466971",
        "price_mom_pct": "3.618784",
        "price_yoy_pct": "7.488444"
      },
      {
        "count_mom_pct": "0.000000",
        "listing_count": 160,
        "median_ppsf_usd": "202.790560",
        "median_price_usd": "366319.000000",
        "month": "2026-04",
        "ppsf_mom_pct": "-0.280166",
        "ppsf_yoy_pct": "4.665225",
        "price_mom_pct": "-0.518429",
        "price_yoy_pct": "8.317994"
      },
      {
        "count_mom_pct": "0.000000",
        "listing_count": 160,
        "median_ppsf_usd": "201.518633",
        "median_price_usd": "361632.000000",
        "month": "2026-05",
        "ppsf_mom_pct": "-0.627212",
        "ppsf_yoy_pct": "2.675436",
        "price_mom_pct": "-1.279486",
        "price_yoy_pct": "3.863071"
      },
      {
        "count_mom_pct": "0.000000",
        "listing_count": 160,
        "median_ppsf_usd": "201.204582",
        "median_price_usd": "354072.000000",
        "month": "2026-06",
        "ppsf_mom_pct": "-0.155842",
        "ppsf_yoy_pct": "4.256209",
        "price_mom_pct": "-2.090523",
        "price_yoy_pct": "1.600164"
      },
      {
        "count_mom_pct": "0.000000",
        "listing_count": 160,
        "median_ppsf_usd": "200.263579",
        "median_price_usd": "362575.000000",
        "month": "2026-07",
        "ppsf_mom_pct": "-0.467685",
        "ppsf_yoy_pct": "3.906210",
        "price_mom_pct": "2.401489",
        "price_yoy_pct": "4.651784"
      },
      {
        "count_mom_pct": "0.000000",
        "listing_count": 160,
        "median_ppsf_usd": "200.389724",
        "median_price_usd": "365806.000000",
        "month": "2026-08",
        "ppsf_mom_pct": "0.062989",
        "ppsf_yoy_pct": "2.716818",
        "price_mom_pct": "0.891126",
        "price_yoy_pct": "3.684598"
      },
      {
        "count_mom_pct": "0.000000",
        "listing_count": 160,
        "median_ppsf_usd": "200.510237",
        "median_price_usd": "365065.500000",
        "month": "2026-09",
        "ppsf_mom_pct": "0.060140",
        "ppsf_yoy_pct": "3.558588",
        "price_mom_pct": "-0.202430",
        "price_yoy_pct": "5.461187"
      }
    ],
    "summary": {
      "last_month_ppsf_yoy_pct": "3.558588",
      "last_month_price_yoy_pct": "5.461187",
      "total_observations": 1920,
      "window_ppsf_change_pct": "1.732921",
      "window_price_change_pct": "5.254577",
      "zip_rankings": [
        {
          "median_ppsf_usd": "240.951335",
          "rank": 1,
          "zip": "75214"
        },
        {
          "median_ppsf_usd": "212.785160",
          "rank": 2,
          "zip": "75093"
        },
        {
          "median_ppsf_usd": "187.280673",
          "rank": 3,
          "zip": "75038"
        },
        {
          "median_ppsf_usd": "159.344679",
          "rank": 4,
          "zip": "75019"
        }
      ]
    },
    "window_end": "2026-09",
    "window_start": "2025-10"
  },
  "metadata": {
    "contract_version": "1.0",
    "dataset_id": "dallas-synth-v1",
    "dataset_view_sha256": "bb0e9f3ed47a65eabbaab4e0a4de192ca7918a61eee111e273a70e145f87692b",
    "effective_seed": 155921,
    "live_campaign_id": null,
    "logical_multiset_sha256": "2a529747902f0f96c52877996b38e38611ee9275389a868ffd111783233735da",
    "mode": "replay",
    "model_profile": "housing-qwen-v4-s155921",
    "prompt_bundle_sha256": "47c9578424b4c58836d002685bf6173c4687fe4fe48bcda41ddeeb9cecdbc4f6",
    "query_sha256": "15ecc4ae6302855d7bd9e25e8e73830e563782681c6f928430db1a1d6a0a18e3",
    "requested_seed": 155921,
    "run_id": "20261015T153909Z-fa9d3b859d",
    "seed_support": "replay_recorded",
    "snapshot_sha256": "bb0e9f3ed47a65eabbaab4e0a4de192ca7918a61eee111e273a70e145f87692b",
    "trace_path": "artifacts/reproductions/20261015T135745Z/cases/MR07-b029-s155921/attempt-001/followup/runs/20261015T153909Z-fa9d3b859d/trace.jsonl"
  },
  "narrative": {
    "caveat_codes": [
      "SYNTHETIC_DATA"
    ],
    "fact_ids": [
      "first_to_last_price",
      "last_month_yoy",
      "observations"
    ],
    "text": "First-to-last median price change: 5.254577% across eleven monthly intervals. Final-month median price year-over-year change: 5.461187%. 1920 qualifying monthly observations from 2025-10 through 2026-09. Synthetic Dallas-themed test feed; these are generated observations."
  },
  "presentation": {
    "area": "SQFT",
    "money": "USD",
    "monthly": [
      {
        "median_price": "346840.500000",
        "median_price_per_area": "197.094741",
        "month": "2025-10"
      },
      {
        "median_price": "346929.500000",
        "median_price_per_area": "197.105321",
        "month": "2025-11"
      },
      {
        "median_price": "358767.500000",
        "median_price_per_area": "195.624195",
        "month": "2025-12"
      },
      {
        "median_price": "356100.000000",
        "median_price_per_area": "199.376972",
        "month": "2026-01"
      },
      {
        "median_price": "355368.000000",
        "median_price_per_area": "202.567495",
        "month": "2026-02"
      },
      {
        "median_price": "368228.000000",
        "median_price_per_area": "203.360307",
        "month": "2026-03"
      },
      {
        "median_price": "366319.000000",
        "median_price_per_area": "202.790560",
        "month": "2026-04"
      },
      {
        "median_price": "361632.000000",
        "median_price_per_area": "201.518633",
        "month": "2026-05"
      },
      {
        "median_price": "354072.000000",
        "median_price_per_area": "201.204582",
        "month": "2026-06"
      },
      {
        "median_price": "362575.000000",
        "median_price_per_area": "200.263579",
        "month": "2026-07"
      },
      {
        "median_price": "365806.000000",
        "median_price_per_area": "200.389724",
        "month": "2026-08"
      },
      {
        "median_price": "365065.500000",
        "median_price_per_area": "200.510237",
        "month": "2026-09"
      }
    ]
  },
  "quality": {
    "codes": [
      "SYNTHETIC_DATA"
    ],
    "sparse_months": [],
    "status": "complete"
  },
  "status": "completed"
}
