{
  "canonical": {
    "monthly": [
      {
        "count_mom_pct": "0.000000",
        "listing_count": 160,
        "median_ppsf_usd": "195.089497",
        "median_price_usd": "352806.500000",
        "month": "2025-08",
        "ppsf_mom_pct": "1.221652",
        "ppsf_yoy_pct": null,
        "price_mom_pct": "1.832254",
        "price_yoy_pct": null
      },
      {
        "count_mom_pct": "0.000000",
        "listing_count": 160,
        "median_ppsf_usd": "193.620096",
        "median_price_usd": "346161.000000",
        "month": "2025-09",
        "ppsf_mom_pct": "-0.753193",
        "ppsf_yoy_pct": null,
        "price_mom_pct": "-1.883610",
        "price_yoy_pct": null
      },
      {
        "count_mom_pct": "0.000000",
        "listing_count": 160,
        "median_ppsf_usd": "197.094741",
        "median_price_usd": "346840.500000",
        "month": "2025-10",
        "ppsf_mom_pct": "1.794568",
        "ppsf_yoy_pct": "4.334685",
        "price_mom_pct": "0.196296",
        "price_yoy_pct": "2.637092"
      },
      {
        "count_mom_pct": "0.000000",
        "listing_count": 160,
        "median_ppsf_usd": "197.105321",
        "median_price_usd": "346929.500000",
        "month": "2025-11",
        "ppsf_mom_pct": "0.005368",
        "ppsf_yoy_pct": "3.276382",
        "price_mom_pct": "0.025660",
        "price_yoy_pct": "-0.471779"
      },
      {
        "count_mom_pct": "0.000000",
        "listing_count": 160,
        "median_ppsf_usd": "195.624195",
        "median_price_usd": "358767.500000",
        "month": "2025-12",
        "ppsf_mom_pct": "-0.751439",
        "ppsf_yoy_pct": "2.532457",
        "price_mom_pct": "3.412221",
        "price_yoy_pct": "6.747607"
      },
      {
        "count_mom_pct": "0.000000",
        "listing_count": 160,
        "median_ppsf_usd": "199.376972",
        "median_price_usd": "356100.000000",
        "month": "2026-01",
        "ppsf_mom_pct": "1.918361",
        "ppsf_yoy_pct": "3.691177",
        "price_mom_pct": "-0.743518",
        "price_yoy_pct": "0.605867"
      },
      {
        "count_mom_pct": "0.000000",
        "listing_count": 160,
        "median_ppsf_usd": "202.567495",
        "median_price_usd": "355368.000000",
        "month": "2026-02",
        "ppsf_mom_pct": "1.600246",
        "ppsf_yoy_pct": "2.841363",
        "price_mom_pct": "-0.205560",
        "price_yoy_pct": "1.948060"
      },
      {
        "count_mom_pct": "0.000000",
        "listing_count": 160,
        "median_ppsf_usd": "203.360307",
        "median_price_usd": "368228.000000",
        "month": "2026-03",
        "ppsf_mom_pct": "0.391382",
        "ppsf_yoy_pct": "4.466971",
        "price_mom_pct": "3.618784",
        "price_yoy_pct": "7.488444"
      },
      {
        "count_mom_pct": "0.000000",
        "listing_count": 160,
        "median_ppsf_usd": "202.790560",
        "median_price_usd": "366319.000000",
        "month": "2026-04",
        "ppsf_mom_pct": "-0.280166",
        "ppsf_yoy_pct": "4.665225",
        "price_mom_pct": "-0.518429",
        "price_yoy_pct": "8.317994"
      },
      {
        "count_mom_pct": "0.000000",
        "listing_count": 160,
        "median_ppsf_usd": "201.518633",
        "median_price_usd": "361632.000000",
        "month": "2026-05",
        "ppsf_mom_pct": "-0.627212",
        "ppsf_yoy_pct": "2.675436",
        "price_mom_pct": "-1.279486",
        "price_yoy_pct": "3.863071"
      },
      {
        "count_mom_pct": "0.000000",
        "listing_count": 160,
        "median_ppsf_usd": "201.204582",
        "median_price_usd": "354072.000000",
        "month": "2026-06",
        "ppsf_mom_pct": "-0.155842",
        "ppsf_yoy_pct": "4.256209",
        "price_mom_pct": "-2.090523",
        "price_yoy_pct": "1.600164"
      },
      {
        "count_mom_pct": "0.000000",
        "listing_count": 160,
        "median_ppsf_usd": "200.263579",
        "median_price_usd": "362575.000000",
        "month": "2026-07",
        "ppsf_mom_pct": "-0.467685",
        "ppsf_yoy_pct": "3.906210",
        "price_mom_pct": "2.401489",
        "price_yoy_pct": "4.651784"
      }
    ],
    "summary": {
      "last_month_ppsf_yoy_pct": "3.906210",
      "last_month_price_yoy_pct": "4.651784",
      "total_observations": 1920,
      "window_ppsf_change_pct": "2.652158",
      "window_price_change_pct": "2.768798",
      "zip_rankings": [
        {
          "median_ppsf_usd": "238.894569",
          "rank": 1,
          "zip": "75214"
        },
        {
          "median_ppsf_usd": "211.775016",
          "rank": 2,
          "zip": "75093"
        },
        {
          "median_ppsf_usd": "186.389901",
          "rank": 3,
          "zip": "75038"
        },
        {
          "median_ppsf_usd": "157.964234",
          "rank": 4,
          "zip": "75019"
        }
      ]
    },
    "window_end": "2026-07",
    "window_start": "2025-08"
  },
  "metadata": {
    "contract_version": "1.0",
    "dataset_id": "dallas-synth-v1",
    "dataset_view_sha256": "bb0e9f3ed47a65eabbaab4e0a4de192ca7918a61eee111e273a70e145f87692b",
    "effective_seed": 104729,
    "live_campaign_id": null,
    "logical_multiset_sha256": "2a529747902f0f96c52877996b38e38611ee9275389a868ffd111783233735da",
    "mode": "live",
    "model_profile": "housing-qwen-v4-s104729",
    "prompt_bundle_sha256": "47c9578424b4c58836d002685bf6173c4687fe4fe48bcda41ddeeb9cecdbc4f6",
    "query_sha256": "13046841e50682826bfc1fe6d7513b43cd9f1bcbd7c3e2a47a7dc4074c5e2658",
    "requested_seed": 104729,
    "run_id": "20261003T070722Z-7c2479a1dc",
    "seed_support": "verified_model_default",
    "snapshot_sha256": "bb0e9f3ed47a65eabbaab4e0a4de192ca7918a61eee111e273a70e145f87692b",
    "trace_path": "artifacts/campaigns/headline-live-v1/cases/MR01-b019-s104729/attempt-001/source/runs/20261003T070722Z-7c2479a1dc/trace.jsonl"
  },
  "narrative": {
    "caveat_codes": [
      "SYNTHETIC_DATA",
      "UNAVAILABLE_LOOKBACK"
    ],
    "fact_ids": [
      "first_to_last_price",
      "last_month_yoy",
      "observations"
    ],
    "text": "First-to-last median price change: 2.768798% across eleven monthly intervals. Final-month median price year-over-year change: 4.651784%. 1920 qualifying monthly observations from 2025-08 through 2026-07. Synthetic Dallas-themed test feed; these are generated observations. Some comparison months are outside the source snapshot."
  },
  "presentation": {
    "area": "SQFT",
    "money": "USD",
    "monthly": [
      {
        "median_price": "352806.500000",
        "median_price_per_area": "195.089497",
        "month": "2025-08"
      },
      {
        "median_price": "346161.000000",
        "median_price_per_area": "193.620096",
        "month": "2025-09"
      },
      {
        "median_price": "346840.500000",
        "median_price_per_area": "197.094741",
        "month": "2025-10"
      },
      {
        "median_price": "346929.500000",
        "median_price_per_area": "197.105321",
        "month": "2025-11"
      },
      {
        "median_price": "358767.500000",
        "median_price_per_area": "195.624195",
        "month": "2025-12"
      },
      {
        "median_price": "356100.000000",
        "median_price_per_area": "199.376972",
        "month": "2026-01"
      },
      {
        "median_price": "355368.000000",
        "median_price_per_area": "202.567495",
        "month": "2026-02"
      },
      {
        "median_price": "368228.000000",
        "median_price_per_area": "203.360307",
        "month": "2026-03"
      },
      {
        "median_price": "366319.000000",
        "median_price_per_area": "202.790560",
        "month": "2026-04"
      },
      {
        "median_price": "361632.000000",
        "median_price_per_area": "201.518633",
        "month": "2026-05"
      },
      {
        "median_price": "354072.000000",
        "median_price_per_area": "201.204582",
        "month": "2026-06"
      },
      {
        "median_price": "362575.000000",
        "median_price_per_area": "200.263579",
        "month": "2026-07"
      }
    ]
  },
  "quality": {
    "codes": [
      "SYNTHETIC_DATA",
      "UNAVAILABLE_LOOKBACK"
    ],
    "sparse_months": [],
    "status": "complete"
  },
  "status": "completed"
}
