{
  "canonical": {
    "monthly": [
      {
        "count_mom_pct": "0.000000",
        "listing_count": 192,
        "median_ppsf_usd": "218.333847",
        "median_price_usd": "440454.000000",
        "month": "2025-09",
        "ppsf_mom_pct": "-0.199062",
        "ppsf_yoy_pct": null,
        "price_mom_pct": "1.096222",
        "price_yoy_pct": null
      },
      {
        "count_mom_pct": "0.000000",
        "listing_count": 192,
        "median_ppsf_usd": "221.770740",
        "median_price_usd": "435983.000000",
        "month": "2025-10",
        "ppsf_mom_pct": "1.574146",
        "ppsf_yoy_pct": "3.578690",
        "price_mom_pct": "-1.015089",
        "price_yoy_pct": "0.927598"
      },
      {
        "count_mom_pct": "0.000000",
        "listing_count": 192,
        "median_ppsf_usd": "221.948272",
        "median_price_usd": "449277.000000",
        "month": "2025-11",
        "ppsf_mom_pct": "0.080052",
        "ppsf_yoy_pct": "4.010670",
        "price_mom_pct": "3.049201",
        "price_yoy_pct": "2.948020"
      },
      {
        "count_mom_pct": "0.000000",
        "listing_count": 192,
        "median_ppsf_usd": "224.290572",
        "median_price_usd": "440324.500000",
        "month": "2025-12",
        "ppsf_mom_pct": "1.055336",
        "ppsf_yoy_pct": "3.434664",
        "price_mom_pct": "-1.992646",
        "price_yoy_pct": "3.009883"
      },
      {
        "count_mom_pct": "0.000000",
        "listing_count": 192,
        "median_ppsf_usd": "223.989020",
        "median_price_usd": "453544.000000",
        "month": "2026-01",
        "ppsf_mom_pct": "-0.134447",
        "ppsf_yoy_pct": "2.004585",
        "price_mom_pct": "3.002218",
        "price_yoy_pct": "4.492030"
      },
      {
        "count_mom_pct": "0.000000",
        "listing_count": 192,
        "median_ppsf_usd": "227.122169",
        "median_price_usd": "450566.000000",
        "month": "2026-02",
        "ppsf_mom_pct": "1.398796",
        "ppsf_yoy_pct": "2.669970",
        "price_mom_pct": "-0.656607",
        "price_yoy_pct": "2.976158"
      },
      {
        "count_mom_pct": "0.000000",
        "listing_count": 192,
        "median_ppsf_usd": "225.908689",
        "median_price_usd": "460067.500000",
        "month": "2026-03",
        "ppsf_mom_pct": "-0.534285",
        "ppsf_yoy_pct": "2.641208",
        "price_mom_pct": "2.108792",
        "price_yoy_pct": "4.822972"
      },
      {
        "count_mom_pct": "0.000000",
        "listing_count": 192,
        "median_ppsf_usd": "228.604343",
        "median_price_usd": "448510.500000",
        "month": "2026-04",
        "ppsf_mom_pct": "1.193250",
        "ppsf_yoy_pct": "3.354068",
        "price_mom_pct": "-2.512023",
        "price_yoy_pct": "2.062014"
      },
      {
        "count_mom_pct": "0.000000",
        "listing_count": 192,
        "median_ppsf_usd": "227.902099",
        "median_price_usd": "448096.000000",
        "month": "2026-05",
        "ppsf_mom_pct": "-0.307188",
        "ppsf_yoy_pct": "2.251993",
        "price_mom_pct": "-0.092417",
        "price_yoy_pct": "4.608194"
      },
      {
        "count_mom_pct": "0.000000",
        "listing_count": 192,
        "median_ppsf_usd": "225.333902",
        "median_price_usd": "454344.500000",
        "month": "2026-06",
        "ppsf_mom_pct": "-1.126886",
        "ppsf_yoy_pct": "2.525139",
        "price_mom_pct": "1.394456",
        "price_yoy_pct": "3.188351"
      },
      {
        "count_mom_pct": "0.000000",
        "listing_count": 192,
        "median_ppsf_usd": "224.564824",
        "median_price_usd": "452442.000000",
        "month": "2026-07",
        "ppsf_mom_pct": "-0.341306",
        "ppsf_yoy_pct": "2.294609",
        "price_mom_pct": "-0.418735",
        "price_yoy_pct": "4.480056"
      },
      {
        "count_mom_pct": "0.000000",
        "listing_count": 192,
        "median_ppsf_usd": "226.336411",
        "median_price_usd": "445677.500000",
        "month": "2026-08",
        "ppsf_mom_pct": "0.788898",
        "ppsf_yoy_pct": "3.458930",
        "price_mom_pct": "-1.495109",
        "price_yoy_pct": "2.295158"
      }
    ],
    "summary": {
      "last_month_ppsf_yoy_pct": "3.458930",
      "last_month_price_yoy_pct": "2.295158",
      "total_observations": 2304,
      "window_ppsf_change_pct": "3.665288",
      "window_price_change_pct": "1.185935",
      "zip_rankings": [
        {
          "median_ppsf_usd": "228.915889",
          "rank": 1,
          "zip": "75201"
        },
        {
          "median_ppsf_usd": "220.645977",
          "rank": 2,
          "zip": "75093"
        }
      ]
    },
    "window_end": "2026-08",
    "window_start": "2025-09"
  },
  "metadata": {
    "contract_version": "1.0",
    "dataset_id": "dallas-synth-v1",
    "dataset_view_sha256": "bb0e9f3ed47a65eabbaab4e0a4de192ca7918a61eee111e273a70e145f87692b",
    "effective_seed": 130363,
    "live_campaign_id": "headline-live-v1",
    "logical_multiset_sha256": "2a529747902f0f96c52877996b38e38611ee9275389a868ffd111783233735da",
    "mode": "replay",
    "model_profile": "housing-qwen-v4-s130363",
    "prompt_bundle_sha256": "47c9578424b4c58836d002685bf6173c4687fe4fe48bcda41ddeeb9cecdbc4f6",
    "query_sha256": "0d3e4ab257715b82578577de58a6c2215e7c35979a5ebdb9815ba0a1dde3b0f5",
    "requested_seed": 130363,
    "run_id": "20261015T153018Z-8dd3bcf444",
    "seed_support": "replay_recorded",
    "snapshot_sha256": "bb0e9f3ed47a65eabbaab4e0a4de192ca7918a61eee111e273a70e145f87692b",
    "trace_path": "artifacts/reproductions/20261015T135745Z/cases/MR05-b025-s130363/attempt-001/followup/runs/20261015T153018Z-8dd3bcf444/trace.jsonl"
  },
  "narrative": {
    "caveat_codes": [
      "SYNTHETIC_DATA",
      "UNAVAILABLE_LOOKBACK"
    ],
    "fact_ids": [
      "first_to_last_price",
      "last_month_yoy",
      "observations",
      "source",
      "support"
    ],
    "text": "First-to-last median price change: 1.185935% across eleven monthly intervals. Final-month median price year-over-year change: 2.295158%. 2304 qualifying monthly observations from 2025-09 through 2026-08. Synthetic Dallas-themed test feed; these are generated observations. All twelve visible months have at least five qualifying observations. Synthetic Dallas-themed test feed; these are generated observations. Some comparison months are outside the source snapshot."
  },
  "presentation": {
    "area": "SQFT",
    "money": "USD",
    "monthly": [
      {
        "median_price": "440454.000000",
        "median_price_per_area": "218.333847",
        "month": "2025-09"
      },
      {
        "median_price": "435983.000000",
        "median_price_per_area": "221.770740",
        "month": "2025-10"
      },
      {
        "median_price": "449277.000000",
        "median_price_per_area": "221.948272",
        "month": "2025-11"
      },
      {
        "median_price": "440324.500000",
        "median_price_per_area": "224.290572",
        "month": "2025-12"
      },
      {
        "median_price": "453544.000000",
        "median_price_per_area": "223.989020",
        "month": "2026-01"
      },
      {
        "median_price": "450566.000000",
        "median_price_per_area": "227.122169",
        "month": "2026-02"
      },
      {
        "median_price": "460067.500000",
        "median_price_per_area": "225.908689",
        "month": "2026-03"
      },
      {
        "median_price": "448510.500000",
        "median_price_per_area": "228.604343",
        "month": "2026-04"
      },
      {
        "median_price": "448096.000000",
        "median_price_per_area": "227.902099",
        "month": "2026-05"
      },
      {
        "median_price": "454344.500000",
        "median_price_per_area": "225.333902",
        "month": "2026-06"
      },
      {
        "median_price": "452442.000000",
        "median_price_per_area": "224.564824",
        "month": "2026-07"
      },
      {
        "median_price": "445677.500000",
        "median_price_per_area": "226.336411",
        "month": "2026-08"
      }
    ]
  },
  "quality": {
    "codes": [
      "SYNTHETIC_DATA",
      "UNAVAILABLE_LOOKBACK"
    ],
    "sparse_months": [],
    "status": "complete"
  },
  "status": "completed"
}
